SPAC,Ticker,IPO,Deadline,Proceeds ($M),Coverage,Sector,Geography,Underwriter,Unit,Common,Warrant,IPO Sector Focus
RedBall Acquisition,RBAC,8/13/2020,8/17/2022,575,33.33%,Media & Entertainment,Global,Goldman Sachs,$10.28,$9.89,$1.16,"Sports, media and data analytics sectors, with a focus on professional sports franchises"
GO Acquisition,GOAC,8/5/2020,8/7/2022,575,33.33%,Travel & Hospitality,Global,Credit Suisse,$10.04,$9.82,$0.70,Travel-related and travel-adjacent businesses in North America and Europe
Health Sciences Acquisitions 2,HSAQ,8/4/2020,8/6/2022,160,0.00%,Healthcare,Global,Chardan,,$9.85,,Biopharma and medical technology in North America or Europe
E.Merge Technology Acquisition,ETAC,7/31/2020,8/4/2022,600,33.33%,Technology,Global,Cantor Fitzgerald,$9.98,$9.84,$0.69,Software and internet technology
CC Neuberger II,PRPB,7/31/2020,8/4/2022,828,25.00%,General,Global,Credit Suisse,$10.06,$9.84,$0.99,Not specified
Ace Convergence,ACEV,7/28/2020,1/30/2022,230,50.00%,Technology,Global,Cantor Fitzgerald,$10.20,$9.93,$0.63,IT infrastructure software and semiconductor
Greencity Acquisition,GRCY,7/24/2020,8/28/2021,40,50.00%,General,Global,Ladenburg Thalmann,$10.38,$10.21,$0.23,Not specified
East Resources Acquisition,ERES,7/23/2020,7/27/2022,345,50.00%,Energy,US/Canada,Wells Fargo,$10.12,$9.83,$0.59,Energy in North America
Pershing Square Tontine,PSTH,7/22/2020,7/24/2022,"4,000.00",33.33%,General,Global,Citigroup,,$19.74,$1.27,"Private, large capitalization, high-quality, growth companies"
HPX,HPX,7/16/2020,7/20/2022,253,50.00%,Consumer,LatAm,Credit Suisse,$10.12,$9.85,$0.58,Brazilian consumer goods and restaurants
Malacca Straits Acquisition,MLAC,7/15/2020,1/17/2022,143.8,50.00%,General,Asia,BTIG,$10.20,$9.93,$0.37,"Southeast Asian business conglomerates in the media, food processing, renewable energy and healthcare industries"
Brilliant Acquisition,BRLI,6/24/2020,12/25/2021,46,*,General,Asia,EarlyBirdCapital,$10.90,$10.11,$0.38,Asia-pacific region
Yunhong,ZGYH,2/13/2020,11/18/2021,69,*,General,Asia,Maxim,$11.00,$10.26,$0.15,Asia (excluding China)
CHP Merger,CHPM,11/22/2019,11/26/2021,300,50.00%,Healthcare,US/Canada,JP Morgan,$10.31,$10.02,$0.55,Healthcare in the United States
Tuscan II,THCA,7/12/2019,12/31/2021,172.5,50.00%,Cannabis,Global,EarlyBirdCapital,$10.20,$10.12,$0.56,Cannabis
AGBA Acquisition,AGBA,5/14/2019,11/16/2021,46,*,General,Asia,Maxim,$11.01,$10.89,$0.20,"Healthcare, education, entertainment and financial services in China"